{
  "$schema": "https://json-schema.org/draft/2020-12/schema",
  "$id": "https://pro-harness.local/schemas/review-pro/state.schema.json",
  "type": "object",
  "additionalProperties": false,
  "required": ["schema_version", "run_id", "slug", "mode", "repository_root", "artifact_root", "target", "current_phase", "phases", "lanes", "evidence_caps", "findings", "production_risks", "outputs", "transport", "workflow_trace", "loaded_contract", "decision"],
  "properties": {
    "schema_version": { "const": "review-pro/state@1" },
    "run_id": { "type": "string", "pattern": "^review-[A-Za-z0-9._:-]+$" },
    "slug": { "type": "string", "pattern": "^[a-z0-9](?:[a-z0-9-]{0,62}[a-z0-9])?$" },
    "mode": { "enum": ["deep", "fast", "reverify"] },
    "repository_root": { "type": "string", "minLength": 1 },
    "artifact_root": { "type": "string", "minLength": 1 },
    "target": {
      "type": "object", "additionalProperties": false,
      "allOf": [{ "$ref": "#/$defs/reviewBinding" }],
      "required": ["repository_identity", "base_sha", "reviewed_head_sha", "diff_digest", "changed_files", "workspace_digest", "workspace_changed_files", "captured_at", "stale"],
      "properties": {
        "repository_identity": { "type": "string", "minLength": 1, "maxLength": 500 },
        "comparison": { "$ref": "#/$defs/comparison" },
        "local_scope": { "$ref": "#/$defs/localScope" },
        "base_sha": { "type": ["string", "null"] },
        "reviewed_head_sha": { "type": ["string", "null"] },
        "diff_digest": { "$ref": "#/$defs/digest" },
        "changed_files": { "type": "array", "uniqueItems": true, "items": { "$ref": "#/$defs/safePath" } },
        "workspace_digest": { "$ref": "#/$defs/digest" },
        "workspace_changed_files": { "type": "array", "uniqueItems": true, "items": { "$ref": "#/$defs/safePath" } },
        "captured_at": { "type": "string", "format": "date-time" },
        "stale": { "type": "boolean" }
      }
    },
    "current_phase": { "type": "integer", "minimum": 1, "maximum": 10 },
    "phases": {
      "type": "object", "additionalProperties": false,
      "required": ["1", "2", "3", "4", "5", "6", "7", "8", "9", "10"],
      "properties": {
        "1": { "$ref": "#/$defs/phaseStatus" }, "2": { "$ref": "#/$defs/phaseStatus" },
        "3": { "$ref": "#/$defs/phaseStatus" }, "4": { "$ref": "#/$defs/phaseStatus" },
        "5": { "$ref": "#/$defs/phaseStatus" }, "6": { "$ref": "#/$defs/phaseStatus" },
        "7": { "$ref": "#/$defs/phaseStatus" }, "8": { "$ref": "#/$defs/phaseStatus" },
        "9": { "$ref": "#/$defs/phaseStatus" }, "10": { "$ref": "#/$defs/phaseStatus" }
      }
    },
    "lanes": {
      "type": "object", "additionalProperties": false,
      "required": ["triggered", "completed", "blocked"],
      "properties": {
        "triggered": { "$ref": "#/$defs/names" },
        "completed": { "$ref": "#/$defs/names" },
        "blocked": { "$ref": "#/$defs/names" }
      }
    },
    "evidence_caps": { "type": "array", "items": { "type": "string", "minLength": 1, "maxLength": 2000 } },
    "findings": { "$ref": "#/$defs/artifactIndex" },
    "production_risks": { "$ref": "#/$defs/artifactIndex" },
    "outputs": { "type": "object", "additionalProperties": { "$ref": "#/$defs/digest" } },
    "transport": {
      "type": "object", "additionalProperties": false,
      "required": ["comment", "mutation", "load", "network"],
      "properties": {
        "comment": { "type": "boolean" }, "mutation": { "type": "boolean" },
        "load": { "type": "boolean" }, "network": { "type": "boolean" }
      }
    },
    "workflow_trace": {
      "type": "object", "additionalProperties": false,
      "required": ["status", "path"],
      "properties": {
        "status": { "enum": ["pending", "valid", "invalid"] },
        "path": { "const": "run-events.jsonl" }
      }
    },
    "loaded_contract": {
      "type": "object", "additionalProperties": false,
      "required": ["command_digest", "core_skill_digest", "routing_digest", "policy_digest", "loaded_at"],
      "properties": {
        "command_digest": { "$ref": "#/$defs/digest" },
        "core_skill_digest": { "$ref": "#/$defs/digest" },
        "routing_digest": { "$ref": "#/$defs/digest" },
        "policy_digest": { "$ref": "#/$defs/digest" },
        "loaded_at": { "type": "string", "format": "date-time" }
      }
    },
    "decision": { "enum": ["SAFE_TO_MERGE", "SAFE_WITH_CONDITIONS", "BLOCKED", "REVIEW_INCOMPLETE"] }
  },
  "$defs": {
    "comparison": { "enum": ["committed-range", "working-tree", "initial-working-tree", "local-directory"] },
    "localScope": { "type": "array", "minItems": 1, "uniqueItems": true, "items": { "$ref": "#/$defs/safePath" } },
    "reviewBinding": {
      "oneOf": [
        { "properties": {
          "comparison": { "enum": ["committed-range", "working-tree"] },
          "local_scope": false,
          "base_sha": { "$ref": "#/$defs/gitSha" },
          "reviewed_head_sha": { "$ref": "#/$defs/gitSha" }
        } },
        { "required": ["comparison"], "properties": {
          "comparison": { "const": "initial-working-tree" },
          "local_scope": false,
          "base_sha": { "const": null },
          "reviewed_head_sha": { "const": null }
        } },
        { "required": ["comparison", "local_scope"], "properties": {
          "comparison": { "const": "local-directory" },
          "local_scope": { "$ref": "#/$defs/localScope" },
          "base_sha": { "const": null },
          "reviewed_head_sha": { "const": null }
        } }
      ]
    },
    "gitSha": { "type": "string", "pattern": "^[0-9a-f]{40,64}$" },
    "digest": { "type": "string", "pattern": "^sha256:[0-9a-f]{64}$" },
    "safePath": { "type": "string", "pattern": "^(?!/)(?!.*\\\\)(?!.*(^|/)\\.\\.(/|$))(?!.*[\\u0000-\\u001f]).+$" },
    "phaseStatus": { "enum": ["pending", "in_progress", "passed", "blocked", "skipped", "stale"] },
    "names": { "type": "array", "uniqueItems": true, "items": { "type": "string", "pattern": "^[a-z][a-z0-9-]*$" } },
    "artifactIndex": {
      "type": "object", "additionalProperties": false,
      "required": ["path", "digest", "count"],
      "properties": {
        "path": { "anyOf": [{ "$ref": "#/$defs/safePath" }, { "type": "null" }] },
        "digest": { "anyOf": [{ "$ref": "#/$defs/digest" }, { "type": "null" }] },
        "count": { "type": "integer", "minimum": 0 }
      }
    }
  }
}
